query_id,text,text_de,text_it,text_fr
79,"mechanisms whereby transmission at high frequencies is affected by weather and time of day
","Mechanismen, bei denen die Übertragung bei hohen Frequenzen durch Wetter und Tageszeit beeinflusst wird",meccanismi in base ai quali la trasmissione ad alta frequenza è influenzata dal tempo e dall'ora del giorno,mécanismes par lesquels la transmission à haute fréquence est affectée par la météo et l'heure de la journée
80,"could you please give me articles about the possibilities of getting rectification using metallic devices
",Könnten Sie mir bitte Artikel über die Möglichkeiten der Rektifizierung mit metallischen Geräten geben?,potrebbe per favore darmi articoli sulle possibilità di ottenere rettifica utilizzando dispositivi metallici,Pourriez-vous me donner des articles sur les possibilités d'obtenir la rectification à l'aide d'appareils métalliques
81,"i wish to calculate the inductance and loss in coils made using printed circuit or other miniaturization ideas. a suitable article
please
","Ich möchte die Induktivität und den Verlust in Spulen berechnen, die mit gedruckten Schaltungen oder anderen Miniaturisierungsideen hergestellt werden. ein passender Artikel bitte",Vorrei calcolare l'induttanza e la perdita in bobine realizzate con circuiti stampati o altre idee di miniaturizzazione. un articolo adatto per favore,Je souhaite calculer l'inductance et la perte en bobines faites à l'aide de circuits imprimés ou d'autres idées de miniaturisation. un article approprié s'il vous plaît
82,"analysis of nonlinear systems using phase plane techniques
",Analyse nichtlinearer Systeme mit Phasenebenen-Techniken,analisi di sistemi non lineari con tecniche di piano di fase,Analyse des systèmes non linéaires utilisant des techniques de plan de phase
83,"miniature low noise high gain high impedance amplifiers
",Miniatur geräuscharm hohe Verstärkung hohe Impedanz Verstärker,amplificatori ad alta impedenza di guadagno in miniatura a basso rumore,miniature faible bruit haut gain amplificateurs haute impédance
84,"control characteristics of sampling servo systems
",Steuerungseigenschaften von Probenahme-Servosystemen,caratteristiche di controllo dei servosistemi di campionamento,caractéristiques de contrôle des servosystèmes de prélèvement
85,"power spectral density distribution obtained using analogue techniques
",Leistungsspektraldichteverteilung mit analogen Techniken,distribuzione della densità spettrale di potenza ottenuta con tecniche analogiche,distribution de la densité spectrale de puissance obtenue à l'aide de techniques analogiques
86,"high stability high input impedance transistorised analogue amplifier
",hohe Stabilität hohe Eingangsimpedanz transistorisierter Analogverstärker,Amplificatore analogico transistorizzato ad alta stabilità ad alta impedenza di ingresso,amplificateur analogique transistorisé à haute stabilité à haute impédance d'entrée
87,"electronic specific heat of a superconductor showing a discontinuity at the superconducting critical temperature
",elektronische spezifische Wärme eines Supraleiters mit einer Diskontinuität bei supraleitender kritischer Temperatur,calore specifico elettronico di un superconduttore che mostra una discontinuità alla temperatura critica superconduttiva,chaleur électronique spécifique d'un supraconducteur montrant une discontinuité à la température critique supraconductrice
88,"an abstract on the field distribution surrounding a charged thin circular disc resting on an infinite dielectric slab
","eine Zusammenfassung der Feldverteilung um eine aufgeladene dünne Kreisscheibe, die auf einer unendlichen dielektrischen Platte ruht",un astratto sulla distribuzione del campo che circonda un sottile disco circolare carico appoggiato su una lastra infinita dielettrica,un résumé sur la distribution du champ entourant un disque circulaire fin chargé reposant sur une dalle diélectrique infinie
89,"tunnel diode construction and its electrical characteristics explained
",Tunnel-Diodenbau und seine elektrischen Eigenschaften erklärt,la costruzione del diodo del tunnel e le sue caratteristiche elettriche spiegate,la construction de la diode du tunnel et ses caractéristiques électriques expliquées
90,"electronic density of states at the surface of a semiconductor compared with that at depth
",elektronische Dichte von Zuständen an der Oberfläche eines Halbleiters im Vergleich zu der in der Tiefe,densità elettronica degli stati sulla superficie di un semiconduttore rispetto a quella a profondità,densité électronique des états à la surface d'un semi-conducteur par rapport à celle à la profondeur
91,"resistivity of metallic thin films related to surface roughness
",Widerstandsfähigkeit von metallischen dünnen Folien im Zusammenhang mit Oberflächenrauheit,resistività delle pellicole sottili metalliche legate alla rugosità superficiale,Résistivité des films métalliques minces liés à la rugosité de surface
92,"the phenomenon of radiation caused by charged particles moving in varying electric and magnetic fields
","das Phänomen der Strahlung durch geladene Teilchen, die sich in unterschiedlichen elektrischen und magnetischen Feldern bewegen",il fenomeno delle radiazioni causate da particelle cariche che si muovono in campi elettrici e magnetici diversi,le phénomène des radiations causées par des particules chargées se déplaçant dans divers champs électriques et magnétiques;
93,"high frequency oscillators using transistors theoretical treatment and practical circuit details
",Hochfrequenz-Oszillatoren mit Hilfe von Transistoren theoretische Behandlung und praktische Schaltung Details,oscillatori ad alta frequenza utilizzando transistor di trattamento teorico e dettagli del circuito pratico,Oscillateurs haute fréquence utilisant des transistors traitement théorique et détails pratiques du circuit
